{
  "id": "me-bake",
  "guid": "9D1C4E72-5A83-4F16-B8D9-27C6E0A5413F",
  "name": "ME Bake",
  "nickname": "ME Bake",
  "category": "Meanders",
  "subcategory": "Objects",
  "status": "stable",
  "introducedIn": "0.2.0",
  "description": {
    "short": "Bake geometry into Rhino with Meanders attributes.",
    "long": "Bakes geometry or ME Objects into the active Rhino document. A Meanders Attribute can be supplied and defaults to an empty ME Attribute. The Bake input is true by default, and a Bake button is also available directly on the component. When Group branch items is enabled, which is the default, baked objects from each Grasshopper branch are placed into a Rhino group."
  },
  "icon": "me-bake.png",
  "inputs": [
    {
      "name": "Geometry",
      "nickname": "G",
      "type": "generic",
      "access": "tree",
      "optional": false,
      "description": "Geometry or ME Objects to bake."
    },
    {
      "name": "Attribute",
      "nickname": "A",
      "type": "ME_Attribute",
      "access": "item",
      "optional": true,
      "description": "Meanders attributes to apply while baking. Defaults to an empty ME Attribute."
    },
    {
      "name": "Bake",
      "nickname": "B",
      "type": "boolean",
      "access": "item",
      "optional": true,
      "description": "When true, bake the supplied geometry during solution. Defaults to true."
    }
  ],
  "outputs": [
    {
      "name": "Message",
      "nickname": "M",
      "type": "text",
      "access": "item",
      "description": "Message describing the bake result."
    }
  ],
  "settings": [
    {
      "name": "Group branch items",
      "type": "boolean",
      "persistent": false,
      "options": ["True", "False"]
    }
  ],
  "errors": [],
  "examples": [
    {
      "title": "Bake branch geometry",
      "description": "With Group branch items enabled, each Grasshopper branch is baked into its own Rhino group."
    }
  ],
  "notes": [
    "The Bake input defaults to true.",
    "An empty ME Attribute is used when no attribute is supplied.",
    "The Bake button on the component bakes the current input data independently of the Bake input value.",
    "Group branch items is enabled by default and can be changed from the component context menu.",
    "The component outputs a text message rather than baked geometry."
  ],
  "related": []
}
