{
  "id": "me-fab-text",
  "guid": "D4A7C92E-8B31-4F65-A2C8-71E9B53F406D",
  "name": "ME Fab Text",
  "nickname": "ME Fab",
  "category": "Meanders",
  "subcategory": "Fabrication",
  "status": "stable",
  "introducedIn": "0.2.0",
  "description": {
    "short": "Create fabrication-ready text geometry.",
    "long": "Creates fabrication-ready text curves on a plane using the Meanders fabrication glyph library. Supported characters are converted directly to lightweight geometric curves. Fabrication markers can be embedded in the text using AR tokens for directional arrows and EG tokens for edge-banding markers."
  },
  "icon": "me-fab-text.png",
  "inputs": [
    {
      "name": "Plane",
      "nickname": "P",
      "type": "plane",
      "access": "item",
      "optional": true,
      "description": "Plane used to place the fabrication text. Defaults to the World XY plane."
    },
    {
      "name": "Text",
      "nickname": "T",
      "type": "text",
      "access": "item",
      "optional": false,
      "description": "Fabrication text containing supported characters and optional AR or EG markers."
    },
    {
      "name": "Text Size",
      "nickname": "S",
      "type": "number",
      "access": "item",
      "optional": true,
      "description": "Height of the text. Default is 1."
    },
    {
      "name": "Justification",
      "nickname": "J",
      "type": "integer",
      "access": "item",
      "optional": true,
      "description": "Text justification. 0=Bottom Left, 1=Bottom Center, 2=Bottom Right, 3=Middle Left, 4=Middle Center, 5=Middle Right, 6=Top Left, 7=Top Center, 8=Top Right. Default is Middle Center. The same options are also available from the component context menu."
    },
    {
      "name": "Spacing",
      "nickname": "Sp",
      "type": "number",
      "access": "item",
      "optional": true,
      "description": "Additional spacing between character slots. The default value is the minimum spacing."
    }
  ],
  "outputs": [
    {
      "name": "Curves",
      "nickname": "C",
      "type": "curve",
      "access": "list",
      "description": "Fabrication text curves."
    }
  ],
  "settings": [],
  "errors": [
    "Unsupported characters produce an error identifying the unsupported character and its position in the input text.",
    "Spacing cannot be negative.",
    "Text Size must be greater than zero.",
    "Justification must be between 0 and 8."
  ],
  "examples": [
    {
      "title": "Basic fabrication text",
      "description": "Create simple fabrication text from supported characters.",
      "text": "H-95"
    },
    {
      "title": "Directional arrows",
      "description": "Insert directional arrows into the text. Each AR marker occupies one character slot and the angle is measured in degrees relative to the local X axis of the text Plane.",
      "text": "N-25<AR-45><AR-195>"
    },
    {
      "title": "Full edge marker",
      "description": "Insert a square edge-banding marker with all four edges visible.",
      "text": "H-95<EG-F>"
    },
    {
      "title": "Partial edge marker",
      "description": "Insert a square edge-banding marker with selected edges omitted. EG-NT removes the top edge.",
      "text": "H-95<EG-NT>"
    }
  ],
  "notes": [
    "Normal characters are generated from the Meanders fabrication glyph library.",
    "Only characters available in the fabrication glyph library are supported.",
    "Each normal character participates as one character in the text layout.",
    "AR markers use the format <AR-angle>, for example <AR-45> or <AR-195>.",
    "The AR angle is measured in degrees relative to the local X axis of the text Plane.",
    "Each AR marker occupies one character slot.",
    "EG markers use the format <EG-flag>.",
    "EG-F displays all four edges of the square marker.",
    "EG-BR displays the Bottom and Right edges.",
    "EG-TR displays the Top and Right edges.",
    "EG-TL displays the Top and Left edges.",
    "EG-BL displays the Bottom and Left edges.",
    "EG-NB displays all edges except Bottom.",
    "EG-NR displays all edges except Right.",
    "EG-NT displays all edges except Top.",
    "EG-NL displays all edges except Left.",
    "Each EG marker occupies one character slot.",
    "Spacing adds distance between character slots and cannot be negative.",
    "Justification can be supplied through the J input or selected from the component context menu.",
    "The default justification is Middle Center.",
    "The default Text Size is 1.",
    "The default Spacing is the minimum spacing."
  ],
  "related": []
}
